drop table if exists t1, t2, t3;
create table t1 (c1 int, _id int);
insert into t1 values(1,null);
insert into t1 values(2,null);
insert into t1 values(3,null);
select * from t1;
c1	_id
1	1
2	2
3	3
set sql_mode="";
update t1 set _id = 10 where c1 = 1;
Warnings:
Warning	1265	data truncated for _id column
select * from t1;
c1	_id
1	1
2	2
3	3
set sql_mode="strict_all_tables";
update t1 set _id = 11 where c1 = 1;
ERROR 22001: cannot update value to _id column
select * from t1;
c1	_id
1	1
2	2
3	3
drop table t1;
create table t1 (_id int, c1 int, unique key (_id) using hash);
insert into t1 values(null, 100);
insert into t1 values(null, 100);
insert into t1 values(null, 100);
insert into t1 values(null, 100);
select * from t1;
_id	c1
1	100
2	100
3	100
4	100
update t1 set c1 = 200 where _id = 2;
select * from t1;
_id	c1
1	100
2	200
3	100
4	100
drop table t1;
create table t1 (_id int, c1 int, key (_id) using hash);
insert into t1 values(null, 100);
insert into t1 values(null, 100);
insert into t1 values(null, 100);
insert into t1 values(null, 100);
select * from t1;
_id	c1
1	100
2	100
3	100
4	100
update t1 set c1 = 200 where _id = 2;
select * from t1;
_id	c1
1	100
2	200
3	100
4	100
drop table t1;
